{
  "$schema": "http://json-schema.org/draft-04/schema#",
  "type": "object",
  "properties": {
    "event": {
      "type": "string"
    },
    "message": {
      "type": "string"
    },
    "sent_at": {
      "type": "string",
      "format": "date-time"
    },
    "user": {
      "type": "object",
      "properties": {
        "id": {
          "type": "string"
        },
        "username": {
          "type": "string"
        },
        "name": {
          "type": [
            "string",
            "null"
          ]
        },
        "gravatar_uid": {
          "type": [
            "string",
            "null"
          ]
        }
      },
      "required": [
        "id",
        "username",
        "name",
        "gravatar_uid"
      ]
    },
    "project": {
      "type": "object",
      "properties": {
        "id": {
          "type": "string"
        },
        "name": {
          "type": "string"
        },
        "main_format": {
          "type": [
            "string",
            "null"
          ]
        },
        "created_at": {
          "type": "string",
          "format": "date-time"
        },
        "updated_at": {
          "type": "string",
          "format": "date-time"
        }
      },
      "required": [
        "id",
        "name",
        "main_format",
        "created_at",
        "updated_at"
      ]
    },
    "branch": {
      "type": "object",
      "properties": {
        "name": {
          "type": "string"
        }
      },
      "required": [
        "name"
      ]
    },
    "screenshot": {
      "type": "object",
      "properties": {
        "id": {
          "type": "string"
        },
        "name": {
          "type": "string"
        },
        "description": {
          "type": "string"
        },
        "screenshot_url": {
          "type": "string"
        },
        "created_at": {
          "type": "string",
          "format": "date-time"
        },
        "updated_at": {
          "type": "string",
          "format": "date-time"
        },
        "markers_count": {
          "type": "integer"
        }
      },
      "required": [
        "id",
        "name",
        "description",
        "screenshot_url",
        "created_at",
        "updated_at",
        "markers_count"
      ]
    }
  },
  "required": [
    "event",
    "message",
    "user",
    "project",
    "screenshot"
  ]
}
