{
  "event": "screenshots:update",
  "message": "john.smith updated screenshot main_view_screenshot in project Translation Project within branch new-feature-1",
  "user": {
    "id": "24b9a53ad72e198ca332fba91bb95f57",
    "username": "john.smith",
    "name": "John Smith",
    "gravatar_uid": "1bc5edb4799fd8eec67c66122f47eb73"
  },
  "project": {
    "id": "b2abd3bd2c23ff0ac546e0a2d9aa0be1",
    "name": "Translation Project",
    "slug": "translation-project",
    "main_format": "yml",
    "project_image_url": null,
    "created_at": "2025-02-07 16:18:13 UTC",
    "updated_at": "2025-02-07 16:18:13 UTC",
    "point_of_contact": null
  },
  "branch": {
    "name": "new-feature-1"
  },
  "screenshot": {
    "id": "b827204f17cefe7fa3b6a8ced17ead26",
    "name": "main_view_screenshot",
    "description": "Showing the main screen",
    "screenshot_url": "http://www.example.com/uploads/screenshots/b827204f17cefe7fa3b6a8ced17ead26/screenshot-7411f4f0a5c11802.jpg",
    "created_at": "2025-02-07 16:18:13 UTC",
    "updated_at": "2025-02-07 16:18:13 UTC",
    "markers_count": 0
  }
}